<?xml version="1.0" encoding="UTF-8"?>
<framework-specification
	xmlns:xsi="http://www.w3.org/2001/XMLSchema-instance"
	xsi:schemaLocation="framework_specification_language_model.xsd"
	xmlns="fwspec" name="invalid-spec">
	<phases>
		<start>
			<explicit-declaration for_all="Ljava/lang/String">
				<method-call>Constructor</method-call>
			</explicit-declaration>
		</start>
		<end>
			<explicit-declaration>
			</explicit-declaration>
		</end>
		<working-phases>
			<working threads="multi">
				<rule-block quantor="for_all" class="Ljava/lang/String">
				</rule-block>
			</working>
			<working threads="single">
				<rule-regex>.*</rule-regex>
			</working>
		</working-phases>
	</phases>
</framework-specification>